name,brand,link,product_description,price,app_area,concern,skin_type,all_ingreds,prod_type,cleaned_ingreds,X,Y
Osmosis +Beauty Quench Nourishing Moisturizer (6.7 fl. oz.),Osmosis +Beauty,https://www.dermstore.com/osmosis-beauty-quench-nourishing-moisturizer-6.7-fl.-oz./12902576.html,"Osmosis +MD's Quench Nourishing Moisturizer replenishes moisture on the skin, revealing a smoother and more radiant complexion. Developed with a powerful formula infused with hyaluronic acid and jojoba seed oil, this lightweight face moisturizer plumps, nourishes and supports a strong moisture barrier.",196.0,"Face,Neck","Dryness and Dehydration,Rosacea","Acne-Prone Skin,Combination Skin,Dry Skin,Mature Skin,Normal Skin,Sensitive Skin","Water (Aqua), Glycerin, Butyrospermum Parkii (Shea Butter), Simmondsia Chinensis (Jojoba) Seed Oil, Cetearyl Olivate, Sorbitan Olivate, Caprylic/Capric Triglyceride, Sodium Hyaluronate, Squalane, Caprooyl-Tetrapeptide-3, Dextran, Sodium PCA, Cetyl Palmitate, Sorbitan Palmitate, Hydrogenated Lecithin, Citrus Aurantifolia (Lime) Oil, Citrus Limon (Lemon) Oil, Hydroxyethylcellulose, Potassium Sorbate, Dehydroacetic Acid, Benzyl Alcohol.",Treatments and Serums,"Water, Glycerin, Butyrospermum Parkii (Shea) Butter, Simmondsia Chinensis (Jojoba) Seed Oil, Cetearyl Olivate, Sorbitan Olivate, Caprylic/Capric Triglyceride, Sodium Hyaluronate, Squalane, Caprooyl Tetrapeptide-3, Dextran, Sodium PCA, Cetyl Palmitate, Sorbitan Palmitate, Hydrogenated Lecithin, Citrus Aurantifolia (Lime) Oil, Citrus Limon (Lemon) Leaf Oil, Hydroxyethylcellulose, Potassium Sorbate, Dehydroacetic Acid, Benzyl Alcohol",6.616047,-9.902257
Paula's Choice SKIN RECOVERY Enriched Calming Toner (6.4 fl. oz.),Paula's Choice,https://www.dermstore.com/paula-s-choice-skin-recovery-enriched-calming-toner-190ml/11174169.html,"Paula's Choice SKIN RECOVERY Enriched Calming Toner soothes and brings relief to dry, irritated skin. This hydrating formula contains essential ingredients dry, flaky skin needs to improve and help defend against dehydration, environmental stress, and aging. It is so gentle, it’s suitable even for skin prone to eczema.",23.0,Face,"Aging Skin,Dryness and Dehydration,Free Radical Damage,Redness,Rosacea","Dry Skin,Normal Skin,Sensitive Skin","Water, Cyclopentasiloxane, Butylene Glycol, Glycereth-26, Dimethiconol, Oenothera Biennis (Evening Primrose) Oil, Borago Officinalis (Borage) Seed Oil, Sodium Hyaluronate, Tocopheryl Acetate, Tocopherol, Ascorbyl Palmitate, Panthenol, Allantoin, Glycerin, Hydrogenated Lecithin, Caprylic/Capric Triglyceride, Niacinamide, Superoxide Dismutase, PEG-40 Hydrogenated Castor Oil, Linoleamidopropyl PG-Dimonium Chloride Phosphate (stabilizer), Laureth-4, Laureth-23, Disodium EDTA, Sodium Benzoate, Phenoxyethanol, Chlorphenesin, Benzoic Acid, and Sorbic Acid.",Treatments and Serums,"Water, Cyclopentasiloxane, Butylene Glycol, Glycereth-26, Dimethiconol, Oenothera Biennis (Evening Primrose) Oil, Borago Officinalis Seed Oil, Sodium Hyaluronate, Tocopheryl Acetate (Vitamin E), Tocopherol (Vitamin E), Ascorbyl Palmitate, Panthenol, Allantoin, Glycerin, Hydrogenated Lecithin, Caprylic/Capric Triglyceride, Niacinamide, Superoxide Dismutase, PEG-40 Hydrogenated Castor Oil, Linoleamidopropyl PG-Dimonium Chloride Phosphate, Laureth-4, Laureth-23, Disodium EDTA, Sodium Benzoate, Phenoxyethanol, Chlorphenesin, Benzoic Acid, Sorbic Acid",8.288267,14.951023
Dr. Dennis Gross Skincare DRx SpectraLite BodyWare Pro 1 piece,Dr Dennis Gross,https://www.dermstore.com/dr-dennis-gross-drx-spectralite-bodyware-pro/12954362.html,"A device unlike no other, Dr. Dennis Gross Skincare's DRx SpectraLite™ BodyWare Pro is a flexible, FDA-cleared light therapy body device that targets fine lines and wrinkles and age spots, clears acne, calms redness and relieves mild muscle and joint pain. The device features a wireless and adjustable design that easily contours to all body zones, shapes, and sizes.",455.0,"Body,Decollete,Feet,Hands,Neck","Acne,Aging Skin,Hyperpigmentation,Redness","Acne-Prone Skin,Combination Skin,Dry Skin,Mature Skin,Normal Skin,Oily Skin,Sensitive Skin",Blue & Red Lights.,Treatments and Serums,none,-0.26534247,-4.6977854
Smashbox Photo Finish Even Skintone Primer (1 fl. oz.),Smashbox,https://www.dermstore.com/smashbox-photo-finish-colour-correcting-foundation-primer-blend-30ml/11873849.html,Instantly blur the look of pores and reduce the look of fine lines with this Smashbox primer. Photo Finish Even Skintone Primer is formulated with a blend of peptides and antioxidants that shield skin against environmental aggressors while effectively prepping skin for makeup application.,39.0,Face,Hyperpigmentation,"Acne-Prone Skin,Combination Skin,Dry Skin,Mature Skin,Normal Skin,Oily Skin,Sensitive Skin","Cyclopentasiloxane, Dimethicone Crosspolymer, Cyclohexasiloxane, Dimethicone, Tocopheryl Acetate, Cymbidium Grandiflorum Flower Extract, Aloe Barbadensis Leaf Extract, Carthamus Tinctorius (Safflower) Seed Oil, Cymbopogon Schoenanthus (Lemongrass) Oil, Glycine Soja (Soybean) Oil, Ethylhexylglycerin, Methicone, Caprylic/Capric Triglyceride, Retinyl Palmitate, Ethylhexyl Salicylate, Talc, Caprylyl Glycol, Hexylene Glycol, Phenoxyethanol, [+/- Titanium Dioxide (Ci 77891), Iron Oxides (Ci 77491, Ci 77492, Ci 77499), Chromium Oxide Greens (Ci 77288), Manganese Violet (Ci 77742), Ultramarines (Ci 77007), Yellow 5 Lake (Ci 19140)] <Ilniln38777>.Please be aware that ingredient lists may change or vary from time to time. Please refer to the ingredient list on the product package you receive for the most up to date list of ingredients.",Treatments and Serums,"Cyclopentasiloxane, Dimethicone Crosspolymer, Cyclohexasiloxane, Dimethicone, Tocopheryl Acetate (Vitamin E), Cymbidium Grandiflorum Flower Extract, Aloe Barbadensis Leaf Extract, Carthamus Tinctorius (Safflower) Seed Oil, Cymbopogon Schoenanthus Oil, Glycine Soja (Soybean) Oil, Ethylhexylglycerin, Methicone, Caprylic/Capric Triglyceride, Retinyl Palmitate (Vitamin A), Ethylhexyl Salicylate, Talc, Caprylyl Glycol, Hexylene Glycol, Phenoxyethanol, Titanium Dioxide, Iron Oxides, CI 77492, CI 77499, Chromium Oxide Greens, Manganese Violet, Ultramarines",-13.989902,-10.744343
Osmosis +Beauty Correct - Preventative Retinal Serum (1 fl. oz.),Osmosis +Beauty,https://www.dermstore.com/osmosis-beauty-correct-preventative-retinal-serum-1-fl.-oz./12901470.html,Osmosis +MD's Correct - Preventative Retinal Serum simultaneously hydrates and restores your complexion for a younger-looking appearance. Peptides promote collagen to smooth wrinkles and increase elasticity while hyaluronic acid drapes your skin in a silky hydrating veil. Lactic acid exfoliates away age spots and discoloration for an even tone.,92.0,Face,"Hyperpigmentation,Scars,Sun Damage","Combination Skin,Dry Skin,Mature Skin,Normal Skin","Water (Aqua), Pentylene Glycol, Niacinamide, Phosphatidylcholine, Glycerin, Asiaticoside, Cyclodextrin, Caprooyl Tetrapeptide-3, Chlorella Vulgaris Extract, Epilobium Angustifolium Flower/Leaf/Stem Extract, Palmitoyl Tripeptide-38, Sodium Hyaluronate, Lactic Acid, Thioctic Acid, Fulvic Acid, Dimethyl Sulfone, Retinal, Beta-Glucan, Hydroxyproline, Citrus Grandis (Grapefruit) Peel Oil, Santalum Austrocaledonicum (Sandalwood) Wood Oil, Rubus Chamaemorus (Cloudberry) Seed Oil, Lonicera Caprifolium (Honeysuckle) Flower Extract, Lonicera Japonica (Honeysuckle) Flower Extract, Dextran, Hydroxypropyl Cyclodextrin, Xanthan Gum, Alcohol Denat., Potassium Sorbate, Sodium Hydroxide, Benzyl Alcohol. *0.075% Retinaldehyde.",Treatments and Serums,"Water, Pentylene Glycol, Niacinamide, Phosphatidylcholine, Glycerin, Asiaticoside, Cyclodextrin, Caprooyl Tetrapeptide-3, Chlorella Vulgaris Extract, Epilobium Angustifolium Flower/Leaf/Stem Extract, Palmitoyl Tripeptide-38, Sodium Hyaluronate, Lactic Acid, Thioctic Acid, Fulvic Acid, Dimethyl Sulfone, Retinal, Beta-Glucan, Hydroxyproline, Citrus Grandis (Grapefruit) Peel Oil, Santalum Austrocaledonicum Wood Oil, Rubus Chamaemorus Seed Oil, Lonicera Caprifolium (Honeysuckle) Flower Extract, Lonicera Japonica (Honeysuckle) Flower Extract, Dextran, Hydroxypropyl Cyclodextrin, Xanthan Gum, Alcohol Denat., Potassium Sorbate, Sodium Hydroxide, Benzyl Alcohol",1.2487805,6.993963
Eminence Organic Skin Care Acne Advanced Clarifying Hydrator 1.2 oz,Eminence Organic Skin Care,https://www.dermstore.com/eminence-organics-acne-advanced-clarifying-hydrator-1.2-oz/11898016.html,"Achieve a nourished complexion with Eminence Organic Skin Care's Acne Advanced Clarifying Hydrator. Enriched with lotus extract and salicylic acid, this lightweight lotion gently reduces breakouts and oiliness so you can look your best at all times.&nb",69.0,Face,"Acne,Hyperpigmentation,Oiliness","Acne-Prone Skin,Combination Skin,Dry Skin,Mature Skin,Normal Skin,Oily Skin,Sensitive Skin","Active: Salicylic Acid 1%.Inactive: Organic Phytonutrient Blend™ [Aloe Barbadensis (Aloe) Juice*, Cucumis Sativus (Cucumber) Juice*, Salix Alba (Willow) Bark Extract*, Rosa Canina (Rosehip) Seed Extract*, Citrus Paradisi (Grapefruit) Peel Extract*, Symphytum Officinale (Comfrey) Leaf Extract*, Lavandula Angustifolia (Lavender) Flower Extract*, Equisetum Arvense (Horsetail) Leaf Extract*, Mentha Piperita (Peppermint) Leaf Extract*, Calendula Officinalis Flower Extract*, Beta Vulgaris (Beetroot) Extract* and Vegetable Glycerin*], Caprylic/Capric Triglyceride, Hamamelis Virginiana (Witch Hazel), Vegetable Glycerin*, Propanediol, Citrus Grandis (Grapefruit) Peel Oil*, Mentha Spicata (Spearmint) Leaf Oil*, Sodium Acrylate, Nyphaea Caerulea (Blue Lotus) Flower Extract, Nelumbo Nucifera (Sacred Lotus) Flower Extract, Benzyl Alcohol, Sorbic Acid, Hydrated Silica, Butyrospermum Parkii (Shea Butter) Extract, Origanum Vulgare (Oregano) Leaf Extract, Thymus Vulgaris (Thyme) Extract, Cinnamomum Zeylanicum (Cinnamon) Bark Extract, Olea Europaea (Olive) Leaf Extract, Rosmarinus Officinalis (Rosemary) Leaf Extract, Sodium Starch Octenylsuccinate, Mentha Piperita (Peppermint) Leaf Extract, Lavandula Angustifolia (Lavender) Flower Extract, Hydrastis Canadensis (Goldenseal) Root Extract, Citrus Limon (Lemon) Peel Extract, Sodium Acryloyldimethyl Taurate Copolymer, Panthenol (Provitamin B5), Sodium Hydroxide, Isohexadecane, Niacinamide (Vitamin B3), Acrylates/C12-22 Alkyl Methacrylate Copolymer, Allantoin, Polysorbate 80, Lysolecithin, Caffeine (from Green Tea)*, Zinc Hyaluronate, Arbutin, Cocamidopropyl Dimethylamine, Biocomplex2™ [Euterpe Oleracea (Acai)*, Citrus Limon (Lemon)*, Malpighia Glabra (Barbados Cherry)*, Emblica Officinalis (Indian Gooseberry)*, Adansonia Digitata (Baobab)*, Myrciaria Dubia (Camu Camu)*, Daucus Carota Sativa (Carrot)*, Cocos Nucifera (Coconut) Water*, Lycium Barbarum (Goji) Berry*, Tapioca Starch (from Cassava Root)*, Thioctic Acid (Alpha Lipoic Acid) and Ubiquinone (Coenzyme Q10)].*Certified Organic Ingredient.",Moisturizers,"Cucumis Sativus (Cucumber) Juice, Salix Alba (Willow) Bark Extract, Rosa Canina Seed Extract, Citrus Paradisi (Grapefruit) Peel Extract, Symphytum Officinale (Comfrey) Extract, Lavandula Angustifolia (Lavender) Flower Extract, Equisetum Arvense Leaf Extract, Mentha Piperita (Peppermint) Leaf Extract, Calendula Officinalis Flower Extract, Beta Vulgaris (Beet) Root Extract, Caprylic/Capric Triglyceride, Hamamelis Virginiana (Witch Hazel), Vegetable Glycerin, Propanediol, Citrus Grandis (Grapefruit) Peel Oil, Mentha Viridis (Spearmint) Leaf Oil, Sodium Acrylate, Nymphaea Coerulea Flower Extract, Nelumbo Nucifera Seed Extract, Benzyl Alcohol, Sorbic Acid, Hydrated Silica, Butyrospermum Parkii (Shea) Butter Extract, Origanum Vulgare Leaf Extract, Thymus Vulgaris (Thyme) Extract, Cinnamomum Zeylanicum Bark Extract, Olea Europaea (Olive) Leaf Extract, Rosmarinus Officinalis (Rosemary) Leaf Extract, Sodium Starch Octenylsuccinate, Mentha Piperita (Peppermint) Leaf Extract, Lavandula Angustifolia (Lavender) Flower Extract, Hydrastis Canadensis (Golden Seal) Root Extract, Citrus Limon (Lemon) Peel Extract, Sodium Acrylate/Sodium Acryloyldimethyl Taurate Copolymer, Panthenol, Sodium Hydroxide, Isohexadecane, Niacinamide, Acrylates/C12-22 Alkyl Methacrylate Copolymer, Allantoin, Polysorbate 80, Lysolecithin, Caffeine, Sodium Hyaluronate, Arbutin, Cocamidopropyl Dimethylamine, Euterpe Oleracea (Acai) Oil, Citrus limon (Lemon), Malpighia Glabra (Acerola) Fruit Extract, Emblica Officinalis Fruit, Adansonia Digitata Oil, Myrciaria Dubia (CAMU CAMU), Daucus Carota Sativa (Carrot) Root, Cocos Nucifera (Coconut) Water, Lycium Barbarum Seed Oil, Tapioca Starch",-17.05677,5.003713
La Roche-Posay Effaclar Deep Cleansing Foaming Cream (4.2 fl. oz.),La Roche-Posay,https://www.dermstore.com/la-roche-posay-effaclar-deep-cleansing-foaming-cream-4.2-fl.-oz/11429051.html,"La Roche-Posay Effaclar is a rich lathering cleansing that purges the skin of debris and blockages that clog and enlarge pores. This creamy cleanser softens thick skin and helps control oil production, leaving you with cleaner, clearer skin. Daily use helps tighten and refine pores, leading to fewer blackheads and pimples.",24.99,Face,"Acne,Large Pores,Oiliness","Acne-Prone Skin,Combination Skin,Oily Skin,Sensitive Skin","Water, Glycerin, Myristic Acid, Potassium hydroxide, Glyceryl Stearate se, Stearic Acid, Lauric Acid, Palmitic Acid, Coco-Glucoside, Tetrasodium EDTA, Parfum, Salicylic Acid.",Treatments and Serums,"Water, Glycerin, Myristic Acid, Potassium Hydroxide, Glyceryl Stearate SE, Stearic Acid, Lauric Acid, Palmitic Acid, Coco-glucoside, Tetrasodium EDTA, Fragrance, Salicylic Acid",-3.604419,-0.0875201
SkinCeuticals Retinol 1.0 Maximum Strength Refining Night Cream (1 fl. oz.),SkinCeuticals,https://www.dermstore.com/skinceuticals-retinol-1.0/11289638.html,"Ideal for skin preconditioned with Retinol 0.5, this SkinCeuticals' night cream targets and corrects the appearance of fine lines, wrinkles and discoloration. Powered by the highest concentration of retinol and botanical extracts, Retinol 1.0 Maximum Strength Refining Night Cream exfoliates skin to reduce the appearance of blemishes and pores while minimizing breakouts.",92.0,"Face,Neck","Acne,Aging Skin,Free Radical Damage,Hyperpigmentation,Large Pores,Milia,Sun Damage","Acne-Prone Skin,Combination Skin,Dry Skin,Mature Skin,Normal Skin,Oily Skin","Aqua/Water/Eau, Propanediol, Dimethicone, Cetearyl Ethylhexanoate, Alcohol Denat., Allyl Methacrylates Crosspolymer, Dipropylene Glycol, Ammonium Polyacryloyldimethyl Taurate, Acrylamide/Sodium Acryloyldimethyltaurate Copolymer, Retinol, Hydrogenated Lecithin, Polysorbate 20, Isohexadecane, Phenoxyethanol, Caprylyl Glycol, Isopropyl Myristate, Sodium Citrate, Boswellia Serrata Gum, Polysorbate 80, Bht, Dimethiconol, Trisodium Ethylenediamine Disuccinate, Bisabolol, Sorbitan Oleate, Citric Acid, Propyl Gallate.",Treatments and Serums,"Water, Propanediol, Dimethicone, Cetearyl Ethylhexanoate, Alcohol Denat., Allyl Methacrylates Crosspolymer, Dipropylene Glycol, Ammonium Polyacryloyldimethyl Taurate, Acrylamide/Sodium Acryloyldimethyltaurate Copolymer, Retinol, Hydrogenated Lecithin, Polysorbate 20, Isohexadecane, Phenoxyethanol, Caprylyl Glycol, Isopropyl Myristate, Sodium Citrate, Boswellia Serrata Gum, Polysorbate 80, BHT, Dimethiconol, Trisodium Ethylenediamine Disuccinate, Alpha-Bisabolol, Sorbitan Oleate, Citric Acid, Propyl Gallate",9.54775,-0.3725833
Eminence Organic Skin Care Arctic Berry Peptide Radiance Cream 2 fl. Oz,Eminence Organic Skin Care,https://www.dermstore.com/eminence-organic-skin-care-arctic-berry-peptide-radiance-cream-2-fl.-oz./12915641.html,"Eminence Organics Arctic Berry Peptide Radiance Cream fights the appearance of wrinkles and age spots and keeps skin hydrated. Featuring their exclusive Peptide Illuminating Complex, this powerful moisturizer includes a a blend of arctic berries, lingonberry seeds and hibiscus extract that works in unison to oxidize free radicals and seal in moisture for bright, smooth skin all day. Soy-free and ideal for all skin types.",98.0,Face,"Aging Skin,Redness,Rosacea,Sun Damage","Dry Skin,Mature Skin,Normal Skin,Sensitive Skin","Organic Phytonutrient Blend™ [Aloe Juice*, Rose Flower Extract*, Five Flavor Berry Extract*, Sweet Orange Peel Extract, Grape Seed Extract, Chamomile Flower Extract*, Beetroot Extract, Calendula Officinalis Flower Extract and Vegetable Glycerin*], Argan Oil, Stearic Acid, Jojoba Seed Oil*, Cetearyl Alcohol, Vegetable Oil, Vitamin E, Arginine, Seaweed Extract*, Provitamin B5, Vegetable Glycerin, Butcher's Broom Root Extract, Ammonium Glycyrrhizate, Gotu Kola Extract, Hydrolyzed Yeast Protein, Butylene Glycol, Calendula Officinalis Flower Extract, Wild Cherry Bark Extract*, Vegetable Squalane, Juniper Sprout Extract, Ferulic Acid, Aromatic Extract Blend, Vitamin C Ester, Glyceryl Caprylate, Glyceryl Undecylenate, Caramel, Azulene, Yellow Plum Bark Extract, Gardenia Meristem Cell Culture, Xanthan Gum, Gotu Kola Meristem Cell Culture, Pichia/Resveratrol Ferment Extract, Hydrolyzed Hibiscus Extract (Botanical Peptides), Lingonberry Seed Oil, Cloudberry Seed Extract, Arctic Roseroot Root Extract, Arctic Meadowsweet Extract, Vitamin C, Dextrin, Astaxanthin, Biocomplex2™ [Acai*, Lemon*, Barbados Cherry*, Indian Gooseberry*, Baobab*, Camu Camu*, Carrot*, Coconut Water*, Goji Berry*, Tapioca Starch (from Cassava Root)*, Alpha Lipoic Acid and Coenzyme Q10].*Certified Organic Ingredient**Biodynamic® ingredients from controlled Demeter production",Treatments and Serums,"Rosa Multiflora (rose) Flower Extract, Berberis Vulgaris (Barberry) Extract, Citrus Aurantium Amara (Bitter Orange) Peel Extract, Vitis Vinifera (Grape) Seed Extract, Chamomilla Recutita (Matricaria) Flower Extract, Beta Vulgaris (Beet) Root Extract, Calendula Officinalis Flower Extract, Argania Spinosa (Argan) Oil, Stearic Acid, Simmondsia Chinensis (Jojoba) Seed Oil, Cetearyl Alcohol, Hydrogenated Vegetable Oil, Tocopherol (Vitamin E), Arginine, Fucus Vesiculosus Extract, Vitamin B, Vegetable Glycerin, Butea Superba Root Extract, Ammonium Glycyrrhizate, Centella Asiatica (Gotu Kola), Hydrolyzed Yeast Protein, Butylene Glycol, Calendula Officinalis Flower Extract, Prunus Serotina (Wild Cherry) Bark Extract, Squalane, Juniperus Communis Sprout Extract, Ferulic Acid, Zingiber Aromaticus Extract, Vitamin C-Ester, Glyceryl Caprylate, Glyceryl Undecylenate, Caramel, Azulene, Ficus Carica (Fig) Bark Extract, Gardenia Jasminoides Meristem Cell Culture, Xanthan Gum, Centella Asiatica Meristem Cell Culture, Pichia/Resveratrol Ferment Extract, Hydrolyzed Hibiscus Esculentus Extract, Vaccinium Macrocarpon (Cranberry) Seed Oil, Eugenia Caryophyllus (Clove) Seed Extract, Arctium Majus Root Extract, Spiraea Ulmaria (Meadowsweet) Leaf Extract, Ascorbic Acid (Vitamin C), Dextrin, Astaxanthin, Citrus limon (Lemon), Prunus Serotina (Wild Cherry), Myrciaria Dubia (CAMU CAMU), Daucus Carota Sativa (Carrot) Root, Cocos Nucifera (Coconut) Water, Euterpe Oleraceae (Acai) Berry, Tapioca Starch",15.799431,9.615739
Shiseido Bio-Performance Advanced Super Revitalizing Cream (1.7 fl. oz.),Shiseido,https://www.dermstore.com/shiseido-bio-performance-advanced-super-revitalizing-cream-50-ml./12901168.html,"Banish dryness and rejuvenate skin with Shiseido's Bio-Performance Advanced Super Revitalizing Cream. Crafted with a powerful, Super Bio-Hyaluronic Acid N formula, this face cream plumps fine lines and wrinkles, while simultaneously replenishing hydration. Bio-Revitalizing Complex shields the skin from environmental aggressors revealing a beautifully smooth, resilient and youthful-looking complexion.",85.0,Face,"Aging Skin,Dryness and Dehydration","Dry Skin,Mature Skin,Normal Skin","Water (Aqua), Glycerin, Butylene Glycol, Isododecane, Isohexadecane, Dimethicone, Cetyl Ethylhexanoate, Hydrogenated Polydecene, Disteardimonium Hectorite, Peg-9 Polydimethylsiloxyethyl Dimethicone, Peg-150, Peg-8 Diisostearate, Phenoxyethanol, Methylparaben, Ethylparaben, Phytosteryl Macadamiate, Sodium Citrate, Fragrance (Parfum), Trisodium Edta, Tocopheryl Acetate, Stearyl Glycyrrhetinate, Hydroxyproline, Citric Acid, Sodium Metaphosphate, Benzyl Benzoate, Alpha-Isomethyl Ionone, Butylphenyl Methylpropional, Hexyl Cinnamal, Linalool, Limonene, Sodium Acetylated Hyaluronate, Citronellol, Geraniol, Saccharomyces Ferment Lysate Filtrate, Rubus Idaeus (Raspberry) Fruit Extract, Iron Oxides (Ci 77492), Syzygium Jambos Leaf Extract, Iron Oxides (Ci 77491), Tocopherol.",Treatments and Serums,"Water, Glycerin, Butylene Glycol, Isododecane, Isohexadecane, Dimethicone, Cetyl Ethylhexanoate, Hydrogenated Polydecene, Disteardimonium Hectorite, PEG-9 Polydimethylsiloxyethyl Dimethicone, PEG-150, PEG-8 Diisostearate, Phenoxyethanol, Methylparaben, Ethylparaben, Phytosteryl Macadamiate, Sodium Citrate, Fragrance, Trisodium EDTA, Tocopheryl Acetate (Vitamin E), Stearyl Glycyrrhetinate, Hydroxyproline, Citric Acid, Sodium Metaphosphate, Benzyl Benzoate, Alpha-Isomethyl Ionone, Butylphenyl Methylpropional, Hexyl Cinnamal, Linalool, Limonene, Sodium Acetylated Hyaluronate, Citronellol, Geraniol, Saccharomyces Ferment Lysate Filtrate, Rubus Idaeus (Raspberry) Fruit Extract, Iron Oxides, Syzygium Jambos Leaf Extract, Iron Oxides, Tocopherol (Vitamin E)",0.23253267,-24.685823
DCL Dermatologic Cosmetic Laboratories C Scape Enzymatic Gel Cleanser (6.7 fl. oz.),DCL Dermatologic Cosmetic Laboratories,https://www.dermstore.com/dcl-c-scape-enzymatic-gel-cleanser/11296519.html,"Liberate your complexion with a revitalizing cleansing system. Enter the DCL Dermatologic Cosmetic Laboratories C Scape Enzymatic Gel Cleanser. Offering a unique formulation of natural enzymes, sugars and fruit acids, this face cleanser whisks away makeup and debris without irritation. This blend of ingredients is designed to re-energize your complexion, sloughing through dry, dead skin cells and pore-clogging oils.",37.0,Face,"Aging Skin,Hyperpigmentation,Large Pores,Oiliness,Redness","Acne-Prone Skin,Combination Skin,Dry Skin,Mature Skin,Normal Skin,Oily Skin,Sensitive Skin","Water (Aqua), Glycerin, Sodium C14-16 Olefin Sulfonate, Cocamidopropyl Betaine, Cocamidopropylamine Oxide, Acrylates Copolymer, Di-PPG-2 Myreth-10 Adipate, Magnesium Ascorbyl Phosphate, Ascorbyl Methylsilanol Pectinate, Bromelain, Panthenol, Camellia Sinensis Leaf Extract, Chamomilla Recutita (Matricaria) Flower Extract, Acer Saccharum (Sugar Maple) Extract, Vaccinium Myrtillus Fruit/Leaf Extract, Saccharum Officinarum (Sugar Cane) Extract, Citrus Bigaradia ( Neroli) Extract, Citrus Bigaradia ( Neroli) Oil, Citrus Aurantium Dulcis (Orange) Fruit Extract, Citrus Limon (Lemon) Fruit Extract, Disodium EDTA, Sodium Hydroxide, Citrus Aurantium Amara (Bitter Orange) Peel Oil, Maltodextrin, Methylpropanediol, Citric Acid, Citral, Phenoxyethanol, Limonene, Potassium Sorbate, Sodium Benzoate.",Cleansers and Exfoliators,"Water, Glycerin, Sodium C14-16 Olefin Sulfonate, Cocamidopropyl Betaine, Cocamidopropylamine Oxide, Acrylates Copolymer, Di-PPG-2 Myreth-10 Adipate, Magnesium Ascorbyl Phosphate, Ascorbyl Methylsilanol Pectinate, Bromelain, Panthenol, Camellia Sinensis Leaf Extract, Chamomilla Recutita (Matricaria) Flower Extract, Acer Saccharum (Sugar Maple) Extract, Vaccinium Myrtillus Fruit/Leaf Extract, Saccharum Officinarum (Sugar Cane) Extract, Citrus Jabara Peel Extract, Citrus Aurantium Amara (Bitter Orange) Oil, Citrus Aurantium Dulcis (Orange) Fruit Extract, Citrus Limon (Lemon) Fruit Extract, Disodium EDTA, Sodium Hydroxide, Citrus Aurantium Amara (Bitter Orange) Peel Oil, Maltodextrin, Methylpropanediol, Citric Acid, Citral, Phenoxyethanol, Limonene, Potassium Sorbate, Sodium Benzoate",0.66380507,-17.025316
Avene Gentle Exfoliating Gel (2.5 fl. oz.),Avene,https://www.dermstore.com/avene-gentle-exfoliating-gel-2.5-fl.-oz/11597707.html,"Avène's Gentle Exfoliating Gel improves skin texture and tone with both physical and chemical exfoliation while still being gentle on skin. Boosted by jojoba beads and salicylic acid, this gentle face scrub works to purify your pores, increase cell turnover and reduce dullness and discoloration for a radiant complexion. Avéne thermal spring water conditions the skin to calm redness and inflammation commonly associated with exfoliating products.",20.0,Face,Redness,"Acne-Prone Skin,Combination Skin,Dry Skin,Mature Skin,Normal Skin,Oily Skin,Sensitive Skin","Avène Thermal Spring Water (Avène Aqua) , Glycerin , Pentylene Glycol, Hydroxyethyl Acrylate/Sodium Acryloyldimethyl Taurate Copolymer, Water (Aqua), Niacinamide, Coco-Glucoside, Cellulose Acetate, Ascorbyl Palmitate, Cetrimonium Bromide, Citric Acid, Fragrance (Parfum), Glyceryl Oleate, Hydrogenated Palm Glycerides Citrate, Jojoba Esters, Lecithin, Polysorbate 60, Red 30 (Ci 73360), Sodium Salicylate, Sorbitan Isostearate, Talc,Tocopherol, Trisodium Ethylenediamine Disuccinate, Zinc Gluconate.",Treatments and Serums,"Glycerin, Pentylene Glycol, Hydroxyethyl Acrylate/Sodium Acryloyldimethyl Taurate Copolymer, Water, Niacinamide, Coco-glucoside, Cellulose Acetate, Ascorbyl Palmitate, Cetrimonium Bromide, Citric Acid, Fragrance, Glyceryl Oleate, Hydrogenated Palm Glycerides Citrate, Jojoba Esters, Lecithin, Polysorbate 60, CI 73360, Sodium Salicylate, Sorbitan Isostearate, Talc, Tocopherol (Vitamin E), Trisodium Ethylenediamine Disuccinate, Zinc Gluconate",12.664397,-6.02201
