name,brand,link,product_description,price,app_area,concern,skin_type,all_ingreds,prod_type,cleaned_ingreds,X,Y
Biopelle Retriderm Serum Mild 0.5 Percent Retinol (1 fl. oz.),Biopelle,https://www.dermstore.com/biopelle-retriderm-serum-mild/11423256.html,"Biopelle Retriderm Serum Mild 0.5% Retinol produces luminous, youthful and refined skin without causing irritation. The vitamin A formula accelerates skin renewal, resulting in softer, smoother skin with diminished wrinkles, fine lines and discoloration. Lindseed extract soothes inflammation and redness for a clear, even and rejuvenated complexion.",84.0,Face,"Aging Skin,Redness","Acne-Prone Skin,Combination Skin,Dry Skin,Mature Skin,Normal Skin,Oily Skin,Sensitive Skin","Water, Soluble Collagen, Glycerin, Hydrolyzed Elastin, Sodium Hyaluronate, Retinol, Tocopheryl Acetate, Linum Usitatissimum (Linseed) Seed Extract, Octoxynol-9, Polysorbate 20, Propylene Glycol, Xanthan Gum, Magnesium Aluminum Silicate, Phenoxyethanol, Ethylhexylglycerin, Zea Mays (Corn) Oil, BHT, Yellow 5",Treatments and Serums,"Water, Soluble Collagen, Glycerin, Hydrolyzed Elastin, Sodium Hyaluronate, Retinol, Tocopheryl Acetate (Vitamin E), Linum Usitatissimum (Linseed) Seed Extract, Octoxynol-9, Polysorbate 20, Propylene Glycol, Xanthan Gum, Magnesium Aluminum Silicate, Phenoxyethanol, Ethylhexylglycerin, Zea Mays (Corn) Oil, BHT, Yellow 5 Lake",2.1437027,3.350611
VivierSkin Retinol 1 Night Complex (1 fl. oz.),VivierSkin,https://www.dermstore.com/vivierskin-retinol-1-night-complex/11370886.html,"Vivier Retinol 1% Night Complex uses professional-strength retinol to encourage cell turnover for younger, firmer-looking skin. The unique formula uses micro-encapsulated retinol, which releases slowly to decrease the chances of irritation and redness and shea butter to soothe skin. Minimize the appearance of fine lines, wrinkles and acne scars, and regain your youthful, vibrant complexion.",114.0,"Face,Neck","Acne,Free Radical Damage,Redness","Acne-Prone Skin,Mature Skin","Acrylates/Acrylamide Copolymer, Allyl Methacrylate Crosspolymer, Argania Spinosa Kernel Oil, Ascorbyl Palmitate, Behenyl Alcohol, Butylated Hydroxy Toluene, Butylparaben, Butyrospermum Parkii (Shea) Butter, Caprylic/Capric Triglyceride, Castor Oil Phosphate, Cetyl Palmitate, Cyclopentasiloxane, Di-C12-15 Alkyl Fumarate, Dimethicone, Dimethiconol, Ethylparaben, Glycerin, Glyceryl Stearate, Magnesium Aluminum Silicate, Methylparaben, Mineral Oil, PEG 100 Stearate, Phenoxyethanol, Polysorbate 20, Polysorbate-85, Propylparaben, Retinol, Squalane, Stearic Acid, Tetrasodium EDTA, Titanium Dioxide, Tocopheryl Acetate, Triethanolamine,Triethoxycaprylylsilane, Water/Eau, Xanthan Gum.",Moisturizers,"Acrylates/Acrylamide Copolymer, Allyl Methacrylates Crosspolymer, Argania Spinosa Kernel Oil, Ascorbyl Palmitate, Behenyl Alcohol, Hydroxylated Lanolin, Butylparaben, Butyrospermum Parkii (Shea) Butter, Caprylic/Capric Triglyceride, Castor Oil Phosphate, Cetyl Palmitate, Cyclopentasiloxane, Di-C12-15 Alkyl Fumarate, Dimethicone, Dimethiconol, Ethylparaben, Glycerin, Glyceryl Stearate, Magnesium Aluminum Silicate, Methylparaben, Mineral Oil, PEG-100 Stearate, Phenoxyethanol, Polysorbate 20, Polysorbate 85, Propylparaben, Retinol, Squalane, Stearic Acid, Tetrasodium EDTA, Titanium Dioxide, Tocopheryl Acetate (Vitamin E), Triethanolamine, Triethoxycaprylylsilane, Water, Xanthan Gum",13.321579,10.217833
Naturopathica Vitamin C Revitalizing Lotion (1.7 fl. oz.),Naturopathica,https://www.dermstore.com/naturopathica-vitamin-c-revitalizing-lotion/11370672.html,"Nourishing and lightweight, Naturopathica's Vitamin C Revitalizing Lotion easily brightens and revitalizes skin. Enriched with essential oils and superoxide dismutase, this antioxidant moisturizer boosts elasticity, soothes dryness and protects against environmental aggressors.",68.0,"Decollete,Face,Neck","Dryness and Dehydration,Free Radical Damage","Acne-Prone Skin,Combination Skin,Dry Skin,Mature Skin,Normal Skin,Oily Skin,Sensitive Skin","Water/Aqua/Eau, Chondrus Crispus (Carrageenan), Glycerin, Helianthus Annuus (Sunflower) Seed Oil, Aloe Barbadensis (Aloe Vera) Leaf Juice, Leuconostoc/Radish Root Ferment Filtrate, Squalane, Rosa Damascena (Rose) Flower Water, Ascorbic Acid/Orange/Citrus Limon/Citrus Aurantifolia Polypeptide, Pueraria Lobata Symbiosome Extract, Triticum Vulgare (Wheat) Germ Oil, Avena Sativa (Oat) Bran Extract, Glycoproteins, Butyrospermum Parkii (Shea) Nut Butter, Phospholipids, Superoxide Dismutase, Borago Officinalis (Borage) Seed Oil, Sclerotium Gum, Urtica Dioica (Nettle) Leaf Extract, Rosa Centifolia (Rose) Bud/Petals Extract, Hydrogenated Lecithin, Rosa Damascena (Rose) Flower Oil, Citrus Sinensis (Blood Orange) Peel Oil, Tilia Cordata (Linden) Flower/Leaf Extract, Rosmarinus Officinalis (Rosemary) Leaf Extract, Xanthan Gum, P-Anisic Acid, Citric Acid.",Treatments and Serums,"Water, Chondrus Crispus (Carrageenan), Glycerin, Helianthus Annuus (Sunflower) Seed Oil, Aloe Barbadensis (Aloe Vera) Juice, Leuconostoc/Radish Root Ferment Filtrate, Squalane, Rosa Damascena Flower Water, Ascorbic Acid/Orange/Citrus Limon/Citrus Aurantifolia Polypeptides, Pueraria Lobata Symbiosome Extract, Triticum Vulgare (Wheat) Germ Oil, Avena Sativa (Oat) Bran Extract, Glycoproteins, Butyrospermum Parkii (Shea) Butter, Phospholipids, Superoxide Dismutase, Borago Officinalis Seed Oil, Sclerotium Gum, Urtica Dioica (Nettle) Leaf Extract, Rosa Centifolia Flower Extract, Hydrogenated Lecithin, Rosa Damascena Flower Oil, Citrus Sinensis (Orange) Peel Extract, Tilia Cordata Flower Extract, Rosmarinus Officinalis (Rosemary) Leaf Extract, Xanthan Gum, p-Anisic Acid, Citric Acid",-3.473405,-12.850752
BABOR Cleansing HY-OL (200 ml.),BABOR,https://www.dermstore.com/babor-cleansing-hy-ol-oil-200ml/11724022.html,"Minimize breakouts with CLEANSING HY-OL by Babor. Combining the cleansing powers of water and oil, this bi-phase cleanser works to wash away impurities from your skin.",25.9,"Decollete,Face,Neck","Acne,Dryness and Dehydration,Oiliness","Acne-Prone Skin,Combination Skin,Dry Skin,Mature Skin,Normal Skin,Oily Skin,Sensitive Skin","Glycine Soja Oil, Sesamum Indicum Seed Oil, Arachis Hypogaea Oil, Decyl Oleate, Octyldodecanol, Alcohol Denat., Peg-40 Sorbitan Peroleate, Helianthus Annuus Seed Oil, Parfum, Tocopheryl Acetate, Aqua, Alcohol, Caprylic/Capric Triglyceride, Bisabolol, Ascorbyl Palmitate, Quillaja Saponaria Bark Extract, Ascorbic Acid, Citric Acid, Tocopherol",Cleansers and Exfoliators,"Glycine Soja (Soybean) Oil, Sesamum Indicum (Sesame) Seed Oil, Arachis Hypogaea (Peanut) Oil, Decyl Oleate, Octyldodecanol, Alcohol Denat., PEG-40 Sorbitan Peroleate, Helianthus Annuus (Sunflower) Seed Oil, Fragrance, Tocopheryl Acetate (Vitamin E), Water, Alcohol, Caprylic/Capric Triglyceride, Alpha-Bisabolol, Ascorbyl Palmitate, Quillaja Saponaria Bark Extract, Ascorbic Acid (Vitamin C), Citric Acid, Tocopherol (Vitamin E)",-10.262262,-4.220107
Oxygenetix Oxygenating Foundation Blue Undertones (15 ml.),Oxygenetix,https://www.dermstore.com/oxygenetix-oxygenating-foundation-blue-undertones-15-ml./12905258.html,"Oxygenetix Oxygenating Foundation helps conceal, minimize and heal breakouts, blemishes, rashes, acne scars, rosacea, wounds and other skin conditions using a unique, super-charged oxygen complex that stimulates skin cell production and speeds the healing process. This SPF 25 foundation blends flawlessly for gorgeous, natural coverage.",66.0,Face,Rosacea,"Acne-Prone Skin,Combination Skin,Dry Skin,Mature Skin,Normal Skin,Oily Skin,Sensitive Skin","Aloe Barbadensis Gel, Isododecane , Titanium Dioxide (and) Methicone, Polyglyceryl -4 Isostearate (and) Cetyl Dimethicone Copolyol (and) Hexyl Laurate, Cyclopentasiloxane, PEG/PPG-20/15 Dimethicone, Saccharomyces Cerevisiae Extract, PEG-8, Dioctyldodecyl Dodecanedioate, Iron Oxides (and) Methicone, Vitis Vinifera (Grape) Seed Extract, Glycerine, 0-cymen-5-OL, Silica, Cyclomethicone (and) Disteardimonium Hectorite (and) Propylene Carbonate, Maris Sal, Dimethicone/Vinyl Dimethicone Crosspolymer",Treatments and Serums,"Aloe Barbadensis (Aloe Vera) Gel, Isododecane, Titanium Dioxide, Polyglyceryl-2 Isostearate/Dimer Dilinoleate Copolymer, Cyclopentasiloxane, PEG/PPG-20/15 Dimethicone, Saccharomyces Cerevisiae Extract, PEG-8, Dioctyldodecyl Dodecanedioate, Iron Oxides, Vitis Vinifera (Grape) Seed Extract, Glycerin, o-Cymen-5-ol, Silica, Disteardimonium Hectorite, Dimethicone/Vinyl Dimethicone Crosspolymer",-5.8901606,-21.068233
ClarityRx Restore It 7.5 Percent Glycolic Exfoliator (2 fl. oz.),ClarityRx,https://www.dermstore.com/clarityrx-restore-it-7.5-percent-glycolic-exfoliator-2-fl.-oz./12901334.html,"Uncover beautiful, healthy-looking skin with ClarityRx Restore It 7.5 Percent Glycolic Exfoliator. This renewing treatment uses glycolic acid to remove damaged, dull skin, revealing new, younger skin cells underneath. This results in less fine lines and wrinkles, dry patches, rough areas and imperfections, while aiding in regulating oily and problematic skin.",60.0,Face,"Aging Skin,Milia","Acne-Prone Skin,Combination Skin,Dry Skin,Mature Skin,Normal Skin,Oily Skin,Sensitive Skin","Purified water, glycolic acid.",Cleansers and Exfoliators,"Water, Glycolic Acid",4.6977563,1.2824228
Natura Bissé Inhibit Tensolift Neck Mask (1 count),Natura Bissé,https://www.dermstore.com/natura-bisse-inhibit-tensolift-neck-mask/12466768.html,"Give your neck area the attention it deserves with Natura Bisse's Inhibit Tensolift Neck Mask. Made from 100% natural bamboo fibers, this décolleté and neck mask is infused with hyaluronic acid and niacinamide to provide intense hydration, diminish the appearance of wrinkles, firm the skin and boost luminosity.",25.0,Neck,Puffiness,"Acne-Prone Skin,Combination Skin,Dry Skin,Mature Skin,Normal Skin,Oily Skin,Sensitive Skin","Water (Aqua), Pentylene Glycol, Niacinamide, Sodium Hyaluronate Crosspolymer, Ethylhexyl Stearate, Polyglyceryl-4 Diisostearate/Polyhydroxystearate/Sebacate, Lecithin, Sodium Acrylates Copolymer, Xanthan Gum, Sodium Isostearate, Disodium EDTA, Fragrance (Parfum), Limonene, Geraniol, Hydroxycitronellal, Linalool, Citronellol, Cinnamyl Alcohol, Citral.Formulations and ingredients may be occasionally modified. You can find up to date information about this product on its package and its leaflet.",Treatments and Serums,"Water, Pentylene Glycol, Niacinamide, Sodium Hyaluronate Crosspolymer, Ethylhexyl Stearate, Polyglyceryl-4 Diisostearate/Polyhydroxystearate/Sebacate, Lecithin, Sodium Acrylates Copolymer, Xanthan Gum, Sodium Isostearate, Disodium EDTA, Fragrance, Limonene, Geraniol, Hydroxycitronellal, Linalool, Citronellol, Cinnamyl Alcohol",17.327068,5.739579
Olga Lorencin Skin Care Weightless Moisturizer (1.7 fl. oz.),Olga Lorencin Skin Care,https://www.dermstore.com/olga-lorencin-skin-care-weightless-moisturizer-1.7-fl.-oz./12901274.html,"Olga Lorencin Skin Care Weightless Moisturizer is a lightweight day cream for hydrating, nourishing and protecting your skin. Formulated with extracts of willow bark, this daily moisturizer helps to repair and improve the skin, while vitamin C brightens and neutralizes free radicals with potent antioxidant actions. Its lemon-eucalyptus aroma refreshes the senses with each application, leaving you feeling invigorated and ready to take on the day.",75.0,"Face,Neck","Acne,Aging Skin,Dryness and Dehydration,Free Radical Damage,Hyperpigmentation,Large Pores,Oiliness,Rosacea,Sun Damage","Acne-Prone Skin,Combination Skin,Dry Skin,Mature Skin,Normal Skin,Oily Skin,Sensitive Skin","Water, Cetyl Ethylhexanoate, Caprylic/Capric Triglyceride, Glycerin, Glycine Soja (Soybean) Seed Extract, Glyceryl Stearate, PEG-100 Stearate, Cetearyl Alcohol, Palmitoyl Tripeptide-5, Teprenone, Tetrahexyldecyl Ascorbate, Ceramide-2, Avena Sativa (Oat) Kernel Extract, Bisabolol, Hamamelis Virginiana (Witch Hazel) Extract, Camellia Oleifera Leaf Extract, Salix Nigra (Willow) Bark Extract, Squalane, Dimethicone, Carbomer, Ceteareth-20, Aminomethyl Propanol, Sodium Phytate, Polyacrylate-13, Polyisobutene, Polysorbate-20, Ethylhexylglycerin, Phenoxyethanol, Potassium Sorbate, Citrus Medica Limonum (Lemon) Peel Oil.",Moisturizers,"Water, Cetyl Ethylhexanoate, Caprylic/Capric Triglyceride, Glycerin, Glycine Soja (Soybean) Seed Extract, Glyceryl Stearate, PEG-100 Stearate, Cetearyl Alcohol, Palmitoyl Tripeptide-5, Teprenone, Tetrahexyldecyl Ascorbate, Ceramide 2, Avena Sativa (Oat) Kernel Extract, Alpha-Bisabolol, Hamamelis Virginiana (Witch Hazel) Extract, Camellia Oleifera Leaf Extract, Salix Nigra (Willow) Bark Extract, Squalane, Dimethicone, Carbomer, Ceteareth-20, Aminomethyl Propanol, Sodium Phytate, Polyacrylate-13, Polyisobutene, Polysorbate 20, Ethylhexylglycerin, Phenoxyethanol, Potassium Sorbate, Citrus Medica Limonum (Lemon) Oil",-11.821652,11.724191
ilike organic skin care Linden and Marigold Rich Moisturizer (1.7 fl. oz.),ilike organic skin care,https://www.dermstore.com/ilike-organic-skin-care-linden-and-marigold-rich-moisturizer-1.7-fl.-oz./12901408.html,"Ilike Organic Skin Care Linden and Marigold Rich Moisturizer (formerly Linden and Marigold Rejuvenating Treatment) revitalizes, smooths and treats skin with sunburns, wrinkles, dryness and stretchmarks. Marigold provides anti-inflammatory and antiseptic benefits to heal and soothe the skin. Linden flower supplies the skin with powerful antioxidants to maintain and protect it for a younger-looking appearance.",79.5,"Body,Face","Dryness and Dehydration,Stretch Marks,Sunburn","Acne-Prone Skin,Combination Skin,Dry Skin,Mature Skin,Normal Skin,Oily Skin,Sensitive Skin","Linden Blossom, Marigold (Calendula), Corn Germ Oil, Castor Oil, Shea Butter, Carotenoids, Vitamin C and E.",Treatments and Serums,"Eugenia Caryophyllus (Clove) Flower Oil, Calendula Officinalis (Pot Marigold), Zea Mays (Corn) Germ Oil, Ricinus Communis (Castor) Seed Oil, Butyrospermum Parkii (Shea) Butter, Carotene, Tocopherol (Vitamin E)",-4.527336,-3.5384953
Perricone MD Brightening Serum (1 fl. oz.),Perricone MD,https://www.dermstore.com/perricone-md-vitamin-c-ester-brightening-serum/11833554.html,"Perricone MD Vitamin C Ester Serum reduces the appearance of lines, hyperpigmenation and dark circles. A unique fat-soluable form of vitamin C penetrates deep into the skin to help skin appear brighter. Vitamin E soothes and moisturizes while ferulic acid, a potent antioxidant, prevents free-radical damage and improves radiance. Beta-glucan and sodium hyaluronate also help to repair and hydrate for a smoother complexion. Ideal for the face, eyes and lips, you'll notice improvements in as little as 7 days.",69.0,Face,"Dark Circles,Free Radical Damage,Hyperpigmentation",Mature Skin,"Water/Aqua/Eau,Tetrahexyldecyl Ascorbate, Caprylyl Methicone, Hydrogenated Lecithin, Behenyl Alcohol, Benzyl Alcohol, Squalane, Rosmarinus Officinalis (Rosemary) Leaf Extract, Ferulic Acid, Simmondsia Chinensis (Jojoba) Seed Oil, Sodium Hyaluronate, Polysorbate 20, Xanthan Gum, Beta-Glucan, Fragrance/Parfum, Sorbitol, Limonene, Stearyl Glycyrrhetinate, Disodium EDTA, Elaeis Guineensis (Palm) Oil, Tocotrienols, Linalool, Tocopherol, Citral, Citronellol.",Treatments and Serums,"Water, Tetrahexyldecyl Ascorbate, Caprylyl Methicone, Hydrogenated Lecithin, Behenyl Alcohol, Benzyl Alcohol, Squalane, Rosmarinus Officinalis (Rosemary) Leaf Extract, Ferulic Acid, Simmondsia Chinensis (Jojoba) Seed Oil, Sodium Hyaluronate, Polysorbate 20, Xanthan Gum, Beta-Glucan, Fragrance, Sorbitol, Limonene, Stearyl Glycyrrhetinate, Disodium EDTA, Elaeis Guineensis (Palm) Oil, Tocotrienols, Linalool, Tocopherol (Vitamin E), Citral, Citronellol",-9.904784,-9.662462
Obagi Medical Professional-C Serum 15% (1 fl. oz.),Obagi Medical,https://www.dermstore.com/obagi-medical-professional-c-serum-15-strength/11291066.html,"Obagi Professional-C Serum 15% infuses your skin with L-ascorbic acid, the only form of vitamin C suitable for topical application. Designed to penetrate deep into your skin, this vitamin C serum provides effective antioxidant protection from UV damage as it brightens away hyperpigmentation and encourages the growth of collagen and elastin fibers.",112.0,"Face,Neck",Free Radical Damage,"Acne-Prone Skin,Combination Skin,Dry Skin,Mature Skin,Normal Skin,Oily Skin,Sensitive Skin","Propylene Glycol, Water, L-Ascorbic Acid, Alcohol, Ascorbyl Glucoside, Fragrance.",Treatments and Serums,"Propylene Glycol, Water, Ascorbic Acid (Vitamin C), Alcohol, Ascorbyl Glucoside, Fragrance",5.469991,-0.11326515
HydroPeptide Purifying Cleanser (6.76 fl. oz.),HydroPeptide,https://www.dermstore.com/hydropeptide-purifying-cleanser/11287833.html,"HydroPeptide Purifying Cleanser draws out impurities, promotes rapid correction of imperfections and addresses the signs of aging for clearer, brighter, more hydrated skin. Kaolin clay and salicylic acid combine to draw out impurities and minimize breakouts while chamomile calms the skin, reduces irritation and inflammation.",56.0,"Face,Neck","Acne,Free Radical Damage,Hyperpigmentation,Large Pores,Oiliness","Acne-Prone Skin,Combination Skin,Mature Skin,Normal Skin,Oily Skin","Active: 0.5% Salicylic Acid.Inactive: Water, Sodium Lauroyl Sarcosinate, Sodium Cocoyl Isethionate, Kaolin, Glycerin, PEG-150 Distearate, Decyl Glucoside, Chondrus Crispus (Carrageenan), Chamomilla Recutita (Matricaria) Flower Extract, Salicylic Acid, Citric Acid, Menthyl Lactate, Melaleuca Alternifolia (Tea Tree) Leaf Oil, Leuconostoc/Radish Root Ferment Filtrate, Citrus Grandis (Grapefruit) Peel Oil, Xanthan Gum, Cellulose Gum, Bentonite, Mandelic Acid, Disodium EDTA, Butylene Glycol, Yeast Polysaccharides, Oryza Sativa (Rice) Bran Extract, Honey (Mel) Extract, Boswellia Serrata Extract, Oligopeptide-10, Phenoxyethanol, Sodium Benzoate.",Cleansers and Exfoliators,"Salicylic Acid, Sodium Lauroyl Sarcosinate, Sodium Cocoyl Isethionate, Kaolin, Glycerin, PEG-150 Distearate, Decyl Glucoside, Chondrus Crispus (Carrageenan), Chamomilla Recutita (Matricaria) Flower Extract, Salicylic Acid, Citric Acid, Menthyl Lactate, Melaleuca Alternifolia (Tea Tree) Leaf Oil, Leuconostoc/Radish Root Ferment Filtrate, Citrus Grandis (Grapefruit) Peel Oil, Xanthan Gum, Cellulose Gum, Bentonite, Mandelic Acid, Disodium EDTA, Butylene Glycol, Yeast Polysaccharides, Oryza Sativa (Rice) Bran Extract, Honey Extract, Boswellia Serrata Extract, Oligopeptide-10, Phenoxyethanol, Sodium Benzoate",16.485035,-1.922477
Bioderma Sébium H2O Micellar Wipes (25 count),Bioderma,https://www.dermstore.com/bioderma-sebium-wipe/12738061.html,"Wipe away impurities and refresh your skin with Bioderma's Sébium Wipes. Formulated with H2O micellar water, these gentle face wipes help keep your skin clean and clear of debris, oil buildup and makeup, while gingko biloba hydrates and soothes your complexion.",10.99,"Eyes,Face,Lips","Acne,Oiliness","Acne-Prone Skin,Combination Skin,Oily Skin","Aqua/Water/Eau, Polysorbate 20, Pentylene Glycol, Disodium Edta, Xylitol, Zinc Gluconate, Parfum, Cetrimonium Bromide, Copper Sulfate, Mannitol, Fructo Oligosaccharides, Hydroxide De Sodium, Rhamnose, Ginkgo Biloba Leaf Extract, Propylene Glycol.",Cleansers and Exfoliators,"Water, Polysorbate 20, Pentylene Glycol, Disodium EDTA, Xylitol, Zinc Gluconate, Fragrance, Cetrimonium Bromide, Copper Sulfate, Mannitol, Fructooligosaccharides, Sodium Hydroxide, Rhamnose, Ginkgo Biloba Leaf Extract, Propylene Glycol",14.243915,-11.805947
boscia Purifying Cleansing Gel (5 fl. oz.),boscia,https://www.dermstore.com/boscia-purifying-cleansing-gel-5-fl.-oz./12902160.html,"Gently remove dirt and makeup with boscia's Purifying Cleansing Gel. Formulated with amino acids and green tea, this cleanser is suitable for large pores, free radical damage and dryness.",32.0,"Decollete,Face,Neck","Dryness and Dehydration,Free Radical Damage,Hypersensitive Skin,Large Pores","Acne-Prone Skin,Combination Skin,Dry Skin,Mature Skin,Normal Skin,Oily Skin,Sensitive Skin","Water/Aqua/Eau, Hydrogenated Starch Hydrolysate, Disodium Cocoyl Glutamate, Diglycerin, Acrylates/Steareth-20 Methacrylate Copolymer, Sodium Cocoyl Glycinate, Butylene Glycol, Methyl Gluceth-10, Sodium Cocoyl Glutamate, Sodium Lauroyl Glutamate, Caprylyl Glycol, 1,2-Hexanediol, Polysorbate 20, Sclerotium Gum, Cellulose Gum, Sodium Chloride, Trisodium Ethylenediamine Disuccinate, Citric Acid, Glycerin, Rosmarinus Officinalis (Rosemary) Leaf Extract, Simmondsia Chinensis (Jojoba) Seed Extract, Pelargonium Graveolens Flower Oil, Hydrangea Serrata Leaf Extract, Camellia Oleifera Leaf Extract, Epilobium Angustifolium Flower/Leaf/Stem Extract",Cleansers and Exfoliators,"Water, Hydrogenated Starch Hydrolysate, Disodium Cocoyl Glutamate, Diglycerin, Acrylates/Steareth-20 Methacrylate Copolymer, Sodium Cocoyl Glycinate, Butylene Glycol, Methyl Gluceth-10, Sodium Cocoyl Glutamate, Sodium Lauroyl Glutamate, Caprylyl Glycol, 1,2-Hexanediol, Polysorbate 20, Sclerotium Gum, Cellulose Gum, Sodium Chloride, Trisodium Ethylenediamine Disuccinate, Citric Acid, Glycerin, Rosmarinus Officinalis (Rosemary) Leaf Extract, Simmondsia Chinensis (Jojoba) Seed Extract, Pelargonium Graveolens Flower Oil, Hydrangea Serrata Leaf Extract, Camellia Oleifera Leaf Extract, Epilobium Angustifolium Flower/Leaf/Stem Extract",11.770008,-1.5915084
Jouer Cosmetics Daily Clarifying Treatment Oil (1 fl. oz.),Jouer Cosmetics,https://www.dermstore.com/jouer-cosmetics-daily-clarifying-treatment-oil-1-fl.-oz./12901712.html,"With all the serums, treatments, masks and such taking up some major counter space on your vanity, it's probably about time you opt for something that can do it all. Enter Jouer Cosmetics Daily Clarifying Treatment Oil. Uniquely designed to play the role of multiple skin care staples, this luxe, lightweight complexion oil provides the hydration your skin needs in an innovative, quick-dry formula.",38.0,Face,"Acne,Large Pores,Oiliness","Acne-Prone Skin,Combination Skin,Dry Skin,Normal Skin,Oily Skin","Vitis Vinifera (Grape) Seed Oil, Simmondsia Chinensis (Jojoba) Seed Oil, Oryza Sativa (Rice) Bran Oil, Helianthus Annuus (Sunflower) Seed Oil, Crambe Abyssinica Seed Oil, Copaifera Officinalis (Balsam Copaiba) Resin, Borago Officinalis Seed Oil, Carapa, Guaianensis Seed Oil, Euterpe Oleracea Fruit Oil, Limnanthes Alba (Meadowfoam) Seed Oil, Melia Azadirachta Seed Oil, Oenothera Biennis (Evening Primrose) Oil, Rosmarinus Officinalis (Rosemary) Leaf Oil, Salvia Hispanica Seed Extract, Tocopherol.",Moisturizers,"Vitis Vinifera (Grape) Seed Oil, Simmondsia Chinensis (Jojoba) Seed Oil, Oryza Sativa (Rice) Bran Oil, Helianthus Annuus (Sunflower) Seed Oil, Crambe Abyssinica Seed Oil, Copaifera Officinalis (Balsam Copaiba) Resin, Borago Officinalis Seed Oil, Caramel, Carapa Guaianensis Seed Oil, Euterpe Oleracea Fruit Oil, Limnanthes Alba (Meadowfoam) Seed Oil, Melia Azadirachta Seed Oil, Oenothera Biennis (Evening Primrose) Oil, Rosmarinus Officinalis (Rosemary) Leaf Oil, Salvia Hispanica Seed Extract, Tocopherol (Vitamin E)",-5.6608152,-4.874476
SK-II Skinpower Eye Cream 15 ml.,SK-II,https://www.dermstore.com/sk-ii-skinpower-eye-cream-15-ml./13129116.html,"SK-II's Skinpower Eye Cream is made to boost hydration and enhance a more youthful appearance around the eyes. This formula features an SK-II exclusive ingredient complex and InfinitPower Technology to help tighten, smooth and firm for a reinvigorated eye area. The nourishing yet lightweight texture quickly melts into the skin making it instantly ready for makeup.",139.0,Eyes,"Aging Skin,Dryness and Dehydration","Acne-Prone Skin,Combination Skin,Dry Skin,Mature Skin,Normal Skin,Oily Skin,Sensitive Skin","Water, Glycerin, Galactomyces Ferment Filtrate, Niacinamide, Isohexadecane, Butylene Glycol, Pentylene Glycol, Trehalose, Isopropyl Isostearate, Petrolatum, Dimethicone, Caprylic/capric Triglyceride, Vinyl Dimethicone/methicone Silsesquioxane Crosspolymer, Polyacrylamide, Polymethylsilsesquioxane, Phytosteryl/behenyl/octyldodecyl Lauroyl Glutamate, Stearyl Alcohol, Cetyl Alcohol, C13-14 Isoparaffin, Behenyl Alcohol, Dipentaerythrityl Tri-polyhydroxystearate, Panthenol, Tocopheryl Acetate, Benzyl Alcohol, Dimethiconol, Methylparaben, Peg-100 Stearate, Cetearyl Alcohol, Cetearyl Glucoside, Laureth-7, Mica, Disodium Edta, Paeonia Albiflora Root Extract, Propylparaben, Palmitic Acid, Stearic Acid, Ethylparaben, Fragrance, Peg-7 Glyceryl Cocoate, Sodium Hydroxide, Hydrolyzed Lupine Protein, Medicago Sativa Alfalfa) Extract, Houttuynia Cordata Extract, Palmitoyl Pentapeptide-4, Methylsilanol Tri-peg-8 Glyceryl Cocoate, Polyquaternium-7, Methicone, Zantedeschia Aethiopica Flower/stem Extract, Ci 77891, Ci 77492.",Treatments and Serums,"Water, Glycerin, Galactomyces Ferment Filtrate, Niacinamide, Isohexadecane, Butylene Glycol, Pentylene Glycol, Trehalose, Isopropyl Isostearate, Petrolatum, Dimethicone, Caprylic/Capric Triglyceride, Vinyl Dimethicone/Methicone Silsesquioxane Crosspolymer, Polyacrylamide, Polymethylsilsesquioxane, Phytosteryl/Behenyl/Octyldodecyl Lauroyl Glutamate, Stearyl Alcohol, Cetyl Alcohol, C13-14 Isoparaffin, Behenyl Alcohol, Dipentaerythrityl Tri-Polyhydroxystearate, Panthenol, Tocopheryl Acetate (Vitamin E), Benzyl Alcohol, Dimethiconol, Methylparaben, PEG-100 Stearate, Cetearyl Alcohol, Cetearyl Glucoside, Laureth-7, Mica, Disodium EDTA, Paeonia Albiflora Root Extract, Propylparaben, Palmitic Acid, Stearic Acid, Ethylparaben, Fragrance, PEG-7 Glyceryl Cocoate, Sodium Hydroxide, Hydrolyzed Lupine Protein, Medicago Sativa (Alfalfa) Extract, Houttuynia Cordata Extract, Palmitoyl Pentapeptide-4, Methylsilanol Tri-PEG-8 Glyceryl Cocoate, Polyquaternium-7, Methicone, Zantedeschia Aethiopica Flower/Stem Extract, CI 77491, CI 77492",17.052488,14.3485
